{
  "$schema": "./ruleset.schema.json",
  "rulesetId": "mongjin-standard-1.0",
  "displayName": "Mongjin Standard 1.0",
  "boardSize": 9,
  "guardCount": 8,
  "goalCells": "center-3",
  "placement": "adjacent",
  "guardMove": "step",
  "kingSurroundLoss": true,
  "noGuardOnGoal": true,
  "kingCapture": true,
  "startingPlayer": "BLACK",
  "information": "perfect",
  "stochastic": false
}
